{"file_sha256":{},"files_required":["config.json","preprocessor_config.json","tokenizer.json","tokenizer_config.json","model.bin"],"kind":"asr","license":"UNKNOWN","name":"example ASR only — PhoWhisper-small shape, faster-whisper converted directory","parameters_b_declared":0.244,"release_date":"UNKNOWN","revision":null,"schema_version":1,"source":"vinai/PhoWhisper-small","status":"example-only","training_data":"UNKNOWN"}