{"file_sha256":{},"files_required":["config.json","generation_config.json","tokenizer.json","tokenizer_config.json","vocab.json","merges.txt","model.safetensors"],"kind":"llm","license":"Apache-2.0","load_kind":"full","max_context_tokens":16384,"name":"example LLM only — Qwen3-4B-Instruct-2507 shape, single-file safetensors layout","parameters_b_declared":4.0,"release_date":"UNKNOWN","revision":"cdbee75","schema_version":1,"source":"Qwen/Qwen3-4B-Instruct-2507","status":"example-only","training_data":"UNKNOWN"}